{"contractVersion":"1.0","source":"STATAREA","requestedDate":"2026-07-21","captureAttempt":{"status":"SUCCEEDED","requestedUrl":"https://www.statarea.com/predictions/date/2026-07-21/competition","finalUrl":"https://www.statarea.com/predictions/date/2026-07-21/competition","hostname":"www.statarea.com","httpStatus":200,"contentType":"text/html","capturedAt":"2026-07-22T13:00:00.000Z","byteSize":100},"snapshot":{"id":"snapshot","contentHash":"aaaaaaaaaaaaaaaaaaaaaaaaaaaaaaaaaaaaaaaaaaaaaaaaaaaaaaaaaaaaaaaa","evidencePath":"var/evidence/statarea/2026-07-21/a.html","exportPath":"var/exports/statarea/2026-07-21/snapshot.json"},"parserVersion":"statarea-daily-raw/1.0.0","counts":{"rowsFound":1,"valid":1,"rejected":0,"duplicates":0,"warnings":0,"unverifiedColumns":6},"rows":[{"sourceRowKey":"bbbbbbbbbbbbbbbbbbbbbbbbbbbbbbbbbbbbbbbbbbbbbbbbbbbbbbbbbbbbbbbb","rowDateRaw":"2026-07-21","kickoffRaw":"18:30","competitionRaw":"BRAZIL - SERIE A","countryRaw":"Brazil","categoryRaw":null,"homeTeamRaw":"Local","awayTeamRaw":"Visitante","orientation":"HOST_GUEST_DOM","rawColumns":[{"key":"column-0","headerRaw":"TIP","valueRaw":"1","ordinal":0,"semanticStatus":"UNVERIFIED","semanticEvidence":null,"normalizedValue":null,"classes":["value"]},{"key":"column-1","headerRaw":"1","valueRaw":"47","ordinal":1,"semanticStatus":"STRUCTURALLY_MAPPED","semanticEvidence":"ordinal","normalizedValue":null,"classes":[]},{"key":"column-2","headerRaw":"X","valueRaw":"27","ordinal":2,"semanticStatus":"STRUCTURALLY_MAPPED","semanticEvidence":"ordinal","normalizedValue":null,"classes":[]},{"key":"column-3","headerRaw":"2","valueRaw":"26","ordinal":3,"semanticStatus":"STRUCTURALLY_MAPPED","semanticEvidence":"ordinal","normalizedValue":null,"classes":[]},{"key":"column-4","headerRaw":"HT1","valueRaw":"33","ordinal":4,"semanticStatus":"STRUCTURALLY_MAPPED","semanticEvidence":"ordinal","normalizedValue":null,"classes":[]},{"key":"column-5","headerRaw":"HTX","valueRaw":"39","ordinal":5,"semanticStatus":"STRUCTURALLY_MAPPED","semanticEvidence":"ordinal","normalizedValue":null,"classes":[]},{"key":"column-6","headerRaw":"HT2","valueRaw":"28","ordinal":6,"semanticStatus":"STRUCTURALLY_MAPPED","semanticEvidence":"ordinal","normalizedValue":null,"classes":[]},{"key":"column-7","headerRaw":"1.5","valueRaw":"73","ordinal":7,"semanticStatus":"UNVERIFIED","semanticEvidence":null,"normalizedValue":null,"classes":[]},{"key":"column-8","headerRaw":"2.5","valueRaw":"44","ordinal":8,"semanticStatus":"UNVERIFIED","semanticEvidence":null,"normalizedValue":null,"classes":[]},{"key":"column-9","headerRaw":"3.5","valueRaw":"23","ordinal":9,"semanticStatus":"UNVERIFIED","semanticEvidence":null,"normalizedValue":null,"classes":[]},{"key":"column-10","headerRaw":"BTS","valueRaw":"50","ordinal":10,"semanticStatus":"UNVERIFIED","semanticEvidence":null,"normalizedValue":null,"classes":[]},{"key":"column-11","headerRaw":"OTS","valueRaw":"50","ordinal":11,"semanticStatus":"UNVERIFIED","semanticEvidence":null,"normalizedValue":null,"classes":[]}],"semanticStatus":"STRUCTURALLY_MAPPED","warnings":[]}],"rejectedRows":[],"rawHeaders":["TIP","1","X","2","HT1","HTX","HT2","1.5","2.5","3.5","BTS","OTS"],"semanticRegistry":[{"headerRaw":"TIP","semanticStatus":"UNVERIFIED","evidence":"raw"},{"headerRaw":"1","semanticStatus":"STRUCTURALLY_MAPPED","evidence":"raw"},{"headerRaw":"X","semanticStatus":"STRUCTURALLY_MAPPED","evidence":"raw"},{"headerRaw":"2","semanticStatus":"STRUCTURALLY_MAPPED","evidence":"raw"},{"headerRaw":"HT1","semanticStatus":"STRUCTURALLY_MAPPED","evidence":"raw"},{"headerRaw":"HTX","semanticStatus":"STRUCTURALLY_MAPPED","evidence":"raw"},{"headerRaw":"HT2","semanticStatus":"STRUCTURALLY_MAPPED","evidence":"raw"},{"headerRaw":"1.5","semanticStatus":"UNVERIFIED","evidence":"raw"},{"headerRaw":"2.5","semanticStatus":"UNVERIFIED","evidence":"raw"},{"headerRaw":"3.5","semanticStatus":"UNVERIFIED","evidence":"raw"},{"headerRaw":"BTS","semanticStatus":"UNVERIFIED","evidence":"raw"},{"headerRaw":"OTS","semanticStatus":"UNVERIFIED","evidence":"raw"}],"warnings":[],"qualityStatus":"CONTROLLED"}
